{
  "$schema": "https://json-schema.org/draft/2020-12/schema",
  "$id": "https://workshop.example/schemas/event-envelope.schema.json",
  "title": "Order event envelope for the catch-all audit workflow",
  "type": "object",
  "additionalProperties": false,
  "required": ["eventId", "eventType", "schemaVersion", "occurredAt", "correlationId", "data"],
  "properties": {
    "eventId": {"type": "string", "format": "uuid"},
    "eventType": {"type": "string", "minLength": 1},
    "schemaVersion": {"type": "string", "const": "1.0"},
    "occurredAt": {"type": "string", "format": "date-time"},
    "correlationId": {"type": "string", "format": "uuid"},
    "data": {"type": "object"}
  }
}
